<?xml version="1.0" encoding="utf-8"?>

<TestComplexContent:document xmlns:xsi="http://www.w3.org/2001/XMLSchema-instance" xsi:schemaLocation="TestComplexContent complex_content.xsd" xmlns:TestComplexContent="TestComplexContent">
    <TestElement2>
        <Element_string>aaaa</Element_string>
        <Element_double>100.22</Element_double>
        <Element_boolean>true</Element_boolean>
        <Element_decimal>5.55</Element_decimal>
        <Element_dateTime>2022-05-10T10:22:49.152+01:00</Element_dateTime>
        <Element_integer>-778</Element_integer>
        <Element_nonNegativeInteger>0</Element_nonNegativeInteger>
        <Element_positiveInteger>663</Element_positiveInteger>
        <Element_integer_ext>-78</Element_integer_ext>
        <Element_boolean_ext>false</Element_boolean_ext>
    </TestElement2>
    <TestElement3>
        <Element_string>bbbb</Element_string>
        <Element_double>55.22</Element_double>
        <Element_boolean>false</Element_boolean>
        <Element_decimal>57.55</Element_decimal>
        <Element_dateTime>2022-05-15T10:22:49.152+01:00</Element_dateTime>
        <Element_integer>1004</Element_integer>
        <Element_nonNegativeInteger>10</Element_nonNegativeInteger>
        <Element_positiveInteger>4</Element_positiveInteger>
    </TestElement3>
    <TestElement5>
        <simple1>5.5</simple1>
    </TestElement5>
</TestComplexContent:document>